{
  "version": 1,
  "site": {
    "name": "mikolajczyk",
    "role": "Platform / DevOps engineer · <b>Warsaw</b> · ~{{years:2011}} years in IT",
    "bio": [
      "I'm a platform/DevOps engineer. I write infrastructure code for multiple clouds and work with Kubernetes as the main platform. I build custom solutions like an mTLS-based application updater for Apple devices, and migrate legacy systems to private and public clouds.",
      "After work I love to fiddle with old and new hardware. I like understanding how things work at the lowest level, from a 6502 out of the 80s to PS4. Most of it ends up in Rust. This site is my portfolio and a way for me to not bury projects in the drawer."
    ],
    "footer": [
      {
        "label": "GitHub",
        "href": "https://github.com/mikolajmikolajczyk"
      },
      {
        "label": "Radicle seed",
        "href": "https://git.mikolajczyk.org"
      },
      {
        "label": "madside",
        "href": "https://madside.dev"
      },
      {
        "label": "radboard",
        "href": "https://radboard.mikolajczyk.org"
      }
    ],
    "cfAnalytics": "5984f7988efc494b869bf53a93ef3dd2"
  },
  "projects": [
    {
      "id": "madside",
      "name": "madside",
      "year": 2026,
      "status": "active",
      "descHtml": "A browser-based IDE for retro machines with a ports-and-adapters architecture. Support for <b>NES, Atari XL, C64, ZX Spectrum and Sega Genesis</b>. Includes autocomplete, debugger and emulator for each supported machine.",
      "chips": [
        "TypeScript",
        "CodeMirror 6",
        "AGPL"
      ],
      "github": "https://github.com/mikolajmikolajczyk/madside",
      "site": "https://madside.dev",
      "shots": [
        {
          "src": "media/madside-welcome.webp",
          "badge": "welcome",
          "alt": "madside welcome screen"
        },
        {
          "src": "media/madside-atari.webp",
          "alt": "madside atari editor",
          "badge": "atari"
        },
        {
          "src": "media/madside-c64-c.webp",
          "alt": "madside c64 editor",
          "badge": "c64"
        },
        {
          "src": "media/madside-genesis.webp",
          "alt": "madside genesis editor",
          "badge": "genesis"
        },
        {
          "src": "media/madside-course.webp",
          "alt": "madside course",
          "badge": "course"
        }
      ],
      "worklog": [
        {
          "kind": "release",
          "ver": "0.20.0",
          "date": "2026-06-27",
          "md": "Often used symbols bar added just above on-screen keyboard on smaller devices, VDP memory and sprite viewer, 2-player input and stereo audio for Genesis target. Optimizations enabled for z88dk toolchain. Improvements to lsp-c created in regards to resolving macros and typedefs.\n\n- added: (ide) On-screen-keyboard symbol bar for touch devices\n- added: Publish site to GitHub Pages on release\n- added: VDP memory viewer — CRAM palette + VRAM tile grid\n- added: VDP sprite viewer + iPad viewport scroll fix\n- added: 2-player input, stereo audio, macro-aware source map\n- added: (zx-c) Variables locals + per-line breakpoints + step-over for sccz80\n- added: Copt to z88dk toolchain\n- fixed: (lsp-c) Resolve macros/enums/exprs in array sizes + macro-sized field names\n- fixed: (lsp-c) Resolve typedef-to-array types (typedef int Row[N])"
        },
        {
          "kind": "note",
          "ver": "Why I'm doing this",
          "date": "2026-06",
          "md": "For a long time I couldn't find any product that would let me write retro code in a modern way. madside is exactly this. madside was created in a way that allows anyone to add new machine, new toolchain or new panel. Easy to use and easy to extend. And can be used even from mobile devices."
        },
        {
          "kind": "release",
          "ver": "v0.19.0",
          "date": "2026-06-25",
          "md": "True **dual-CPU debugging** for Sega Genesis — single-instruction 68000 step plus full Z80 breakpoints, stepping and current-line.\n\n- added: welcome screen redesign — token-driven reskin, two-column layout\n- added: z88dk sccz80 C source-level debugging (C_LINE + link map → source map)"
        },
        {
          "kind": "release",
          "ver": "v0.18.0",
          "date": "2026-06-25",
          "md": "**Bank-aware addressing** across machines (ADR-0014): Atari 130XE, NES PRG banking and ZX Spectrum 128K — bank-aware breakpoints, live-bank indicator, banked source maps.\n\n- added: a new assembly **LSP** — hover, go-to-definition, find-references, rename and diagnostics across 6502 / M68k / Z80\n- added: Genesis dual-CPU foundation — assemble your own Z80 sound into the ROM"
        },
        {
          "kind": "release",
          "ver": "v0.17.0",
          "date": "2026-06-24",
          "md": "**Sega Genesis / 68000** target — clownassembler (M68k) with Musashi and gpgx cores, an M68k debug adapter and a hello-world template.\n\n- added: consent gate + content-hash trust for project-local plugins"
        },
        {
          "kind": "release",
          "ver": "v0.16.0",
          "date": "2026-06-23",
          "md": "**ZX Spectrum 48K** (z88dk, Z80) plus first-class **C language servers** — completion, hover, go-to-definition, find-references, rename and semantic diagnostics for cc65 C and z88dk Z80 C.\n\n- added: in-app **course authoring** — lesson CRUD, live preview, export/import\n- added: themes as plugins + a dockable (dockview) layout, variables/watch panels"
        },
        {
          "kind": "release",
          "ver": "v0.15.0",
          "date": "2026-06-19",
          "md": "**Commodore 64** machine — chips emulator with the cc65 and MADS toolchains and starter templates."
        },
        {
          "kind": "release",
          "ver": "v0.11.0",
          "date": "2026-06-18",
          "md": "First big public release: write **NES games in C** (cc65, compiled in-browser), a command palette, an app-wide **VFS + WASI bridge**, and multi-target cc65 (NES + Atari).\n\n- added: cross-file C completion, clang-format on save, inline build diagnostics\n- added: production / supply-chain hardening — CSP, security headers, a biting lint gate"
        },
        {
          "kind": "note",
          "ver": "Full changelog",
          "date": "2026-06-25",
          "md": "The entries above are the highlights. Every release, with full detail, lives in the [complete CHANGELOG.md](https://github.com/mikolajmikolajczyk/madside/blob/main/CHANGELOG.md).",
          "pinned": true,
          "feed": false
        }
      ]
    },
    {
      "id": "radboard",
      "name": "radboard",
      "year": 2026,
      "status": "active",
      "descHtml": "A desktop GUI for <b>Radicle</b> (P2P git) in Tauri/Rust. Kanban columns, patch workflow, staging, inline code review, worktree checkout. Distributed as AppImage, .deb, .rpm, and a Nix flake.",
      "chips": [
        "Rust",
        "Tauri",
        "AGPL"
      ],
      "github": "https://github.com/mikolajmikolajczyk/radboard",
      "site": "https://radboard.mikolajczyk.org",
      "shots": [
        {
          "src": "media/radboard-issues.webp",
          "alt": "radboard issues",
          "badge": "issues"
        },
        {
          "src": "media/radboard-milestones.webp",
          "alt": "radboard milestones",
          "badge": "milestones"
        },
        {
          "src": "media/radboard-patches.webp",
          "alt": "radboard patches",
          "badge": "patches"
        },
        {
          "src": "media/radboard-files.webp",
          "alt": "radboard files",
          "badge": "files"
        }
      ],
      "worklog": [
        {
          "kind": "release",
          "ver": "v0.8.0",
          "date": "2026-06-09",
          "md": "- added: **ctrl-K repo switcher** with fuzzy search\n- added: 🌱 good-first-issue badges + most-wanted toggle in the Open column\n- changed: migrate to the **radicle 0.24** crate; resize handles on the frameless window"
        },
        {
          "kind": "release",
          "ver": "v0.7.0",
          "date": "2026-06-09",
          "md": "- added: **worktree + patch sync**, with merge blocked on conflicts\n- added: link patches to issues via commit messages\n- added: periodic sync of the active repo\n- added: **epics** — parent/child issue grouping"
        },
        {
          "kind": "release",
          "ver": "v0.5.0",
          "date": "2026-06-03",
          "md": "A big board batch:\n\n- added: markdown preview in the issue editor + comments\n- added: copyable issue-id badges, assignees, label filtering\n- added: blocked / blocks indicators; persisted `state:*` columns\n- added: **AUR `radboard-bin`** package + auto-publish (v0.5.1)"
        },
        {
          "kind": "release",
          "ver": "v0.4.0",
          "date": "2026-04-21",
          "md": "- added: **milestones** support\n- added: worktree view — create patches from worktrees (branch selection, deferred editor)\n- added: create a new issue from the list view; reopen the last board on launch"
        },
        {
          "kind": "release",
          "ver": "v0.2.0",
          "date": "2026-04-08",
          "md": "- added: redesigned **Create / Update patch** modals\n- added: closing an issue asks for a close status\n- added: COB changes notify the node"
        },
        {
          "kind": "release",
          "ver": "v0.1.1",
          "date": "2026-04-01",
          "md": "First stable beta — the Radicle desktop GUI ships, with build automation (AppImage / .deb / .rpm / Nix)."
        },
        {
          "kind": "note",
          "ver": "Full changelog",
          "date": "2026-06-10",
          "pinned": true,
          "feed": false,
          "md": "The entries above are the highlights. Full per-version detail lives in the [complete CHANGELOG.md](https://github.com/mikolajmikolajczyk/radboard/blob/master/CHANGELOG.md)."